[
  {
    "name": "Acid Splash",
    "level": 0,
    "school": "evocation",
    "castingTime": "Action",
    "range": "60 feet",
    "components": {
      "verbal": true,
      "somatic": true,
      "material": false
    },
    "duration": "Instantaneous",
    "description": "You create an acidic bubble at a point within range, where it explodes in a 5-foot-radius Sphere. Each creature in that Sphere must succeed on a Dexterity saving throw or take 1d6 Acid damage.\n\nCantrip Upgrade. The damage increases by 1d6 when you reach levels 5 (2d6), 11 (3d6), and 17 (4d6).",
    "classes": [
      "artificer",
      "sorcerer",
      "wizard"
    ]
  },
  {
    "name": "Blade Ward",
    "level": 0,
    "school": "abjuration",
    "castingTime": "Action",
    "range": "Self",
    "components": {
      "verbal": true,
      "somatic": true,
      "material": false
    },
    "duration": "Concentration, up to 1 minute",
    "description": "Whenever a creature makes an attack roll against you before the spell ends, the attacker subtracts 1d4 from the attack roll.",
    "classes": [
      "bard",
      "sorcerer",
      "warlock",
      "wizard"
    ]
  },
  {
    "name": "Chill Touch",
    "level": 0,
    "school": "necromancy",
    "castingTime": "Action",
    "range": "Touch",
    "components": {
      "verbal": true,
      "somatic": true,
      "material": false
    },
    "duration": "Instantaneous",
    "description": "Channeling the chill of the grave, make a melee spell attack against a target within reach. On a hit, the target takes 1d10 Necrotic damage, and it can’t regain Hit Points until the end of your next turn.\n\nCantrip Upgrade. The damage increases by 1d10 when you reach levels 5 (2d10), 11 (3d10), and 17 (4d10).",
    "classes": [
      "sorcerer",
      "warlock",
      "wizard"
    ]
  }
]